{"schema":"ai-news-entities/1","schemaVersion":1,"generatedAt":"2026-10-17T18:39:37Z","windowDays":7,"days":["2026-10-11","2026-10-12","2026-10-13","2026-10-14","2026-10-15","2026-10-16","2026-10-17"],"entities":[{"name":"OpenAI","type":"company","count":54,"trend":[0,0,0,14,18,17,5],"today":5,"prevAvg":8.2,"rising":false,"lastSeenAt":"2026-10-17T16:31:12Z","topTags":["safety","policy","research"]},{"name":"NVIDIA","type":"company","count":45,"trend":[1,0,0,2,20,14,8],"today":8,"prevAvg":6.2,"rising":false,"lastSeenAt":"2026-10-17T17:59:00Z","topTags":["release","safety","tooling"]},{"name":"Anthropic","type":"company","count":43,"trend":[0,0,0,8,16,14,5],"today":5,"prevAvg":6.3,"rising":false,"lastSeenAt":"2026-10-17T14:42:56Z","topTags":["safety","policy","research"]},{"name":"Meta","type":"company","count":37,"trend":[0,0,0,2,14,12,9],"today":9,"prevAvg":4.7,"rising":true,"lastSeenAt":"2026-10-17T16:00:00Z","topTags":["tooling","release","research"]},{"name":"Google","type":"company","count":30,"trend":[0,0,0,8,8,8,6],"today":6,"prevAvg":4,"rising":false,"lastSeenAt":"2026-10-17T13:00:00Z","topTags":["research","policy","tooling"]},{"name":"Hugging Face","type":"company","count":24,"trend":[1,0,0,2,11,9,1],"today":1,"prevAvg":3.8,"rising":false,"lastSeenAt":"2026-10-17T10:33:28Z","topTags":["release","tooling"]},{"name":"Apple","type":"company","count":20,"trend":[0,0,0,1,14,2,3],"today":3,"prevAvg":2.8,"rising":false,"lastSeenAt":"2026-10-17T07:30:00Z","topTags":["research","policy"]},{"name":"ChatGPT","type":"product","count":17,"trend":[0,0,0,2,5,10,0],"today":0,"prevAvg":2.8,"rising":false,"lastSeenAt":"2026-10-16T22:45:01Z","topTags":["safety","policy","tooling"]},{"name":"Alibaba","type":"company","count":15,"trend":[0,0,0,2,4,7,2],"today":2,"prevAvg":2.2,"rising":false,"lastSeenAt":"2026-10-17T13:44:17Z","topTags":["release","research","policy"]},{"name":"llama.cpp","type":"product","count":15,"trend":[0,0,0,0,5,6,4],"today":4,"prevAvg":1.8,"rising":true,"lastSeenAt":"2026-10-17T13:44:17Z","topTags":["tooling","release"]},{"name":"DeepSeek","type":"company","count":11,"trend":[0,0,0,0,3,2,6],"today":6,"prevAvg":0.8,"rising":true,"lastSeenAt":"2026-10-17T15:00:37Z","topTags":["release","tooling","pricing"]},{"name":"Microsoft","type":"company","count":8,"trend":[0,0,0,0,4,4,0],"today":0,"prevAvg":1.3,"rising":false,"lastSeenAt":"2026-10-16T13:50:01Z","topTags":["policy","release","research"]},{"name":"Muse Spark Open","type":"model","count":8,"trend":[0,0,0,0,5,3,0],"today":0,"prevAvg":1.3,"rising":false,"lastSeenAt":"2026-10-16T13:00:00Z","topTags":["release","tooling"]},{"name":"Qwen 3.8","type":"model","count":8,"trend":[0,0,0,0,3,4,1],"today":1,"prevAvg":1.2,"rising":false,"lastSeenAt":"2026-10-17T06:23:41Z","topTags":["release","research"]},{"name":"Amazon","type":"company","count":7,"trend":[0,0,0,0,5,2,0],"today":0,"prevAvg":1.2,"rising":false,"lastSeenAt":"2026-10-16T11:00:00Z","topTags":["pricing","policy"]},{"name":"Claude Code","type":"product","count":7,"trend":[0,0,0,3,2,2,0],"today":0,"prevAvg":1.2,"rising":false,"lastSeenAt":"2026-10-16T20:53:06Z","topTags":["release","tooling","safety"]},{"name":"Ollama","type":"company","count":7,"trend":[0,0,0,1,3,2,1],"today":1,"prevAvg":1,"rising":false,"lastSeenAt":"2026-10-17T15:29:04Z","topTags":["release","tooling","policy"]},{"name":"Tencent","type":"company","count":7,"trend":[0,0,0,1,1,2,3],"today":3,"prevAvg":0.7,"rising":true,"lastSeenAt":"2026-10-17T16:37:22Z","topTags":["release"]},{"name":"Codex","type":"product","count":5,"trend":[0,0,0,2,1,2,0],"today":0,"prevAvg":0.8,"rising":false,"lastSeenAt":"2026-10-16T00:00:00Z","topTags":["tooling","policy","release"]},{"name":"Intel","type":"company","count":5,"trend":[0,0,0,0,1,4,0],"today":0,"prevAvg":0.8,"rising":false,"lastSeenAt":"2026-10-16T17:07:47Z","topTags":["tooling"]},{"name":"vLLM","type":"product","count":5,"trend":[0,0,0,2,1,1,1],"today":1,"prevAvg":0.7,"rising":false,"lastSeenAt":"2026-10-17T00:25:45Z","topTags":["release","tooling"]},{"name":"Apple Intelligence","type":"product","count":4,"trend":[0,0,0,1,1,1,1],"today":1,"prevAvg":0.5,"rising":false,"lastSeenAt":"2026-10-17T07:30:00Z","topTags":["policy"]},{"name":"ByteDance","type":"company","count":4,"trend":[0,0,0,1,2,1,0],"today":0,"prevAvg":0.7,"rising":false,"lastSeenAt":"2026-10-16T03:15:02Z","topTags":["release"]},{"name":"ComfyUI","type":"product","count":4,"trend":[0,0,0,0,2,1,1],"today":1,"prevAvg":0.5,"rising":false,"lastSeenAt":"2026-10-17T04:26:50Z","topTags":["release","tooling"]},{"name":"Gemini 4 Argon","type":"model","count":4,"trend":[0,0,0,1,1,2,0],"today":0,"prevAvg":0.7,"rising":false,"lastSeenAt":"2026-10-16T14:18:44Z","topTags":["research"]},{"name":"GPT-6-Astra","type":"model","count":4,"trend":[0,0,0,2,1,1,0],"today":0,"prevAvg":0.7,"rising":false,"lastSeenAt":"2026-10-16T16:01:37Z","topTags":[]},{"name":"Moonshot","type":"company","count":4,"trend":[0,0,0,0,1,2,1],"today":1,"prevAvg":0.5,"rising":false,"lastSeenAt":"2026-10-17T08:00:11Z","topTags":["release"]},{"name":"Qwen3.8 27B","type":"model","count":4,"trend":[0,0,0,0,1,2,1],"today":1,"prevAvg":0.5,"rising":false,"lastSeenAt":"2026-10-17T06:23:41Z","topTags":["research"]},{"name":"DeepSeek-v4.1-Flash","type":"model","count":3,"trend":[0,0,0,0,1,1,1],"today":1,"prevAvg":0.3,"rising":false,"lastSeenAt":"2026-10-17T14:15:01Z","topTags":["release","pricing","tooling"]},{"name":"Huawei","type":"company","count":3,"trend":[0,0,0,0,1,1,1],"today":1,"prevAvg":0.3,"rising":false,"lastSeenAt":"2026-10-17T12:36:00Z","topTags":[]},{"name":"Qwen 3","type":"model","count":3,"trend":[0,0,0,0,1,2,0],"today":0,"prevAvg":0.5,"rising":false,"lastSeenAt":"2026-10-16T14:52:38Z","topTags":["release","research"]},{"name":"Qwen3.8 Flash","type":"model","count":3,"trend":[0,0,0,0,2,1,0],"today":0,"prevAvg":0.5,"rising":false,"lastSeenAt":"2026-10-16T21:18:11Z","topTags":[]},{"name":"Replit","type":"company","count":3,"trend":[0,0,0,0,0,3,0],"today":0,"prevAvg":0.5,"rising":false,"lastSeenAt":"2026-10-16T22:45:01Z","topTags":[]},{"name":"xAI","type":"company","count":3,"trend":[0,0,0,0,1,2,0],"today":0,"prevAvg":0.5,"rising":false,"lastSeenAt":"2026-10-16T19:11:00Z","topTags":[]},{"name":"Zhipu","type":"company","count":3,"trend":[0,0,0,0,1,1,1],"today":1,"prevAvg":0.3,"rising":false,"lastSeenAt":"2026-10-17T07:36:36Z","topTags":["release","research","safety"]},{"name":"AMD","type":"company","count":2,"trend":[0,0,0,1,0,1,0],"today":0,"prevAvg":0.3,"rising":false,"lastSeenAt":"2026-10-16T20:00:21Z","topTags":[]},{"name":"DeepSeek-V4.1-Flash-1017","type":"model","count":2,"trend":[0,0,0,0,0,0,2],"today":2,"prevAvg":0,"rising":true,"lastSeenAt":"2026-10-17T10:33:28Z","topTags":["release"]},{"name":"GLM-5.3","type":"model","count":2,"trend":[0,0,0,0,1,1,0],"today":0,"prevAvg":0.3,"rising":false,"lastSeenAt":"2026-10-16T00:00:00Z","topTags":["research","safety"]},{"name":"Model Context Protocol","type":"product","count":2,"trend":[0,0,0,0,0,2,0],"today":0,"prevAvg":0.3,"rising":false,"lastSeenAt":"2026-10-16T10:11:19Z","topTags":["tooling","release"]},{"name":"Perplexity","type":"company","count":2,"trend":[0,0,0,0,2,0,0],"today":0,"prevAvg":0.3,"rising":false,"lastSeenAt":"2026-10-15T20:00:13Z","topTags":["research"]},{"name":"Qwen Flash","type":"model","count":2,"trend":[0,0,0,0,0,1,1],"today":1,"prevAvg":0.2,"rising":false,"lastSeenAt":"2026-10-17T11:58:07Z","topTags":[]},{"name":"Qwen3 8B","type":"model","count":2,"trend":[0,0,0,0,0,2,0],"today":0,"prevAvg":0.3,"rising":false,"lastSeenAt":"2026-10-16T14:52:38Z","topTags":["release","research"]},{"name":"Apertus 1.5","type":"model","count":1,"trend":[0,0,0,0,1,0,0],"today":0,"prevAvg":0.2,"rising":false,"lastSeenAt":"2026-10-15T09:08:45Z","topTags":["release"]},{"name":"Character.AI","type":"company","count":1,"trend":[0,0,0,1,0,0,0],"today":0,"prevAvg":0.2,"rising":false,"lastSeenAt":"2026-10-14T18:47:54Z","topTags":[]},{"name":"Claude Opus 5.5","type":"model","count":1,"trend":[0,0,0,1,0,0,0],"today":0,"prevAvg":0.2,"rising":false,"lastSeenAt":"2026-10-14T13:24:22Z","topTags":["safety"]},{"name":"Claude Opus 5.5 Max","type":"model","count":1,"trend":[0,0,0,1,0,0,0],"today":0,"prevAvg":0.2,"rising":false,"lastSeenAt":"2026-10-14T21:23:01Z","topTags":[]},{"name":"Cursor","type":"product","count":1,"trend":[0,0,0,0,0,1,0],"today":0,"prevAvg":0.2,"rising":false,"lastSeenAt":"2026-10-16T19:11:00Z","topTags":[]},{"name":"DeepSeek-4.1-Flash-1017","type":"model","count":1,"trend":[0,0,0,0,0,0,1],"today":1,"prevAvg":0,"rising":false,"lastSeenAt":"2026-10-17T05:34:11Z","topTags":["release","tooling"]},{"name":"DeepSeek-v4-Flash-0731","type":"model","count":1,"trend":[0,0,0,0,1,0,0],"today":0,"prevAvg":0.2,"rising":false,"lastSeenAt":"2026-10-15T23:06:40Z","topTags":[]},{"name":"DeepSeek-v4-Pro-Base","type":"model","count":1,"trend":[0,0,0,0,0,1,0],"today":0,"prevAvg":0.2,"rising":false,"lastSeenAt":"2026-10-16T02:20:01Z","topTags":["release"]},{"name":"Figma","type":"company","count":1,"trend":[0,0,0,0,1,0,0],"today":0,"prevAvg":0.2,"rising":false,"lastSeenAt":"2026-10-15T04:30:00Z","topTags":[]},{"name":"Flux 3 Image Klein","type":"model","count":1,"trend":[0,0,0,0,1,0,0],"today":0,"prevAvg":0.2,"rising":false,"lastSeenAt":"2026-10-15T17:38:48Z","topTags":["release"]},{"name":"Flux Klein 3","type":"model","count":1,"trend":[0,0,0,0,0,1,0],"today":0,"prevAvg":0.2,"rising":false,"lastSeenAt":"2026-10-16T12:30:53Z","topTags":["release"]},{"name":"GLM-5.2-Base","type":"model","count":1,"trend":[0,0,0,0,0,0,1],"today":1,"prevAvg":0,"rising":false,"lastSeenAt":"2026-10-17T07:36:36Z","topTags":["release"]},{"name":"Google DeepMind","type":"company","count":1,"trend":[0,0,0,0,1,0,0],"today":0,"prevAvg":0.2,"rising":false,"lastSeenAt":"2026-10-15T16:08:03Z","topTags":[]},{"name":"GPT Live 1","type":"model","count":1,"trend":[0,0,0,1,0,0,0],"today":0,"prevAvg":0.2,"rising":false,"lastSeenAt":"2026-10-14T12:00:00Z","topTags":[]},{"name":